name,mastodon,twitter,instagram,linkedin,photo,bio
Sophia Yang,,sophiamyang,,sophiamyang,"img/keynote/sophia.jpeg","Sophia Yang is a Senior Data Scientist and a Developer Advocate at Anaconda. She is passionate about the data science community and the Python open-source community. She is the author of multiple Python open-source libraries such as condastats, cranlogs, PyPowerUp, intake-stripe, and intake-salesforce. She serves on the Steering Committee and the Code of Conduct Committee of the Python open-source visualization system HoloViz. She also volunteers at NumFOCUS, PyData, and SciPy conferences. She holds an M.S. in Computer Science, an M.S. in Statistics, and a Ph.D. in Educational Psychology from The University of Texas at Austin."
Jimena Bermúdez,Jimena_y_yo@mastodon.social,Jimena_y_yo,,jimena-eb,"img/keynote/jimena.jpeg","Jimena is the esteemed president of Python Spain and a computer engineer who takes pride and joy in her profession. Although she was once drawn to the realms of design, UI, and UX, her true passion lies in coding and architectural design. A gifted communicator, Jimena has served as a web development instructor for individuals transitioning careers. She is an avid mentor, community speaker, and event organizer, holding active memberships in both Python Spain and PyLadies. With numerous publications emphasizing the importance of coding education and industry diversity, Jimena can be best described as a 'Full Stack developer ardently championing diversity, equity, and inclusion (DEI) from a tech standpoint and cherishing her role in the community.'"
Marlene Mhangami,Marlene@fosstodon.org,marlene_zw,marlene_zw,marlenemhangami,"img/keynote/marlene.jpg","Marlene is a Zimbabwean software engineer, explorer, and speaker based in the city of Harare. She is a previous director and vice-chair for the Python Software Foundation and is currently serving as the vice-chair of the Association for Computing Machinery practitioner board. In 2017, she co-founded ZimboPy, a non-profit organization that gives Zimbabwean young women access to resources in the field of technology. She is also the previous chair of PyCon Africa and is an advocate for women in tech on the continent. Professionally, Marlene is currently working as a Developer Advocate at Voltron Data."
Thais Viana,,,,,"img/keynote/thais.jpeg","Thais is currently a Group Product Manager at Jusbrasil, leading their Search & Recommendation team. Her active engagement in the tech community, including contributions to PyLadies in Rio de Janeiro and Afropython for more than 6 years, highlights her commitment to promoting diversity and inclusion in the industry."
Abigail Mesrenyame Dogbe,,,,,"img/keynote/abigail.jpg","Abigail Mesrenyame Dogbe is an Open Source Programs Manager, Researcher and Community Builder who believes in the power of Open Source Community Building. Her current research focuses on Improving DEI in Open Source Community Leadership. She is a contributor and community member in the African Python Software Community and has served as an organizer for local and international community events. Mesrenyame is a Fellow and a Community Service award winner at the Python Software Foundation."
Carolina Chavier,,,,,"img/keynote/carolina.jpeg","Some text"
